Capturing on 'tun0'
    1 0.000000000 fe80::fc1f:a329:400:d904 → ff02::2      ICMPv6 48 Router Solicitation
    2 0.000013149 192.168.1.16 → 93.184.216.34 TCP 52 50216 → 80 [FIN, ACK] Seq=1 Ack=1 Win=501 Len=0 TSval=2337149674 TSecr=357799859
    3 0.568480705 fe80::5ec8:2488:6df6:f13b → ff02::2      ICMPv6 48 Router Solicitation
    4 3.399176360 fe80::5ec8:2488:6df6:f13b → ff02::2      ICMPv6 48 Router Solicitation
    5 5.359234760 192.168.1.16 → 93.184.216.34 TCP 60 50260 → 80 [SYN] Seq=0 Win=64240 Len=0 MSS=1460 SACK_PERM=1 TSval=2337155033 TSecr=0 WS=128
    6 5.486363755 93.184.216.34 → 192.168.1.16 TCP 60 80 → 50260 [SYN, ACK] Seq=0 Ack=1 Win=65535 Len=0 MSS=1460 SACK_PERM=1 TSval=1396789615 TSecr=2337155033 WS=512
    7 5.486430477 192.168.1.16 → 93.184.216.34 TCP 52 50260 → 80 [ACK] Seq=1 Ack=1 Win=64256 Len=0 TSval=2337155160 TSecr=1396789615
    8 5.486768532 192.168.1.16 → 93.184.216.34 HTTP 131 GET / HTTP/1.1 
    9 5.634685160 93.184.216.34 → 192.168.1.16 TCP 60 80 → 50260 [ACK] Seq=1 Ack=80 Win=65536 Len=0 TSval=1396789763 TSecr=2337155160
   10 5.959393672 93.184.216.34 → 192.168.1.16 TCP 1500 HTTP/1.1 200 OK  [TCP segment of a reassembled PDU]
   11 5.959451209 192.168.1.16 → 93.184.216.34 TCP 52 50260 → 80 [ACK] Seq=80 Ack=1449 Win=64128 Len=0 TSval=2337155633 TSecr=1396789764
   12 6.008806357 93.184.216.34 → 192.168.1.16 HTTP 216 HTTP/1.1 200 OK  (text/html)
   13 6.575811955 696e:6174:696f:6e20:6f72:2061:736b:696e → 6720:666f:7220:7065:726d:6973:7369:6f6e IPv6 1500 Unknown IP Protocol: any 0-hop protocol (114)
   14 16.639992856 fe80::fc1f:a329:400:d904 → ff02::2      ICMPv6 48 Router Solicitation
   15 51.209999792 192.168.1.16 → 93.184.216.34 TCP 52 [TCP Retransmission] 50216 → 80 [FIN, ACK] Seq=1 Ack=1 Win=501 Len=0 TSval=2337200884 TSecr=357799859
   16 51.839990825 fe80::fc1f:a329:400:d904 → ff02::2      ICMPv6 48 Router Solicitation
   17 66.559989275 192.168.1.16 → 93.184.216.34 TCP 52 [TCP Keep-Alive] 50260 → 80 [ACK] Seq=79 Ack=1449 Win=64128 Len=0 TSval=2337216234 TSecr=1396789764
   18 117.435922512 192.168.1.16 → 93.184.216.34 TCP 52 50260 → 80 [FIN, ACK] Seq=80 Ack=1449 Win=64128 Len=0 TSval=2337267109 TSecr=1396789764