tshark base:

 5 10.824501205 192.168.1.16 → 2.18.74.134  TCP 60 55060 → 80 [SYN] Seq=0 Win=64240 Len=0 MSS=1460 SACK_PERM=1 TSval=2958671831 TSecr=0 WS=128
    6 10.835163109  2.18.74.134 → 192.168.1.16 TCP 60 80 → 55060 [SYN, ACK] Seq=0 Ack=1 Win=65160 Len=0 MSS=1460 SACK_PERM=1 TSval=2198219085 TSecr=2958671831 WS=128
    7 11.863683874  2.18.74.134 → 192.168.1.16 TCP 60 [TCP Retransmission] 80 → 55060 [SYN, ACK] Seq=0 Ack=1 Win=65160 Len=0 MSS=1460 SACK_PERM=1 TSval=2198220114 TSecr=2958671831 WS=128
    8 13.910675016  2.18.74.134 → 192.168.1.16 TCP 60 [TCP Retransmission] 80 → 55060 [SYN, ACK] Seq=0 Ack=1 Win=65160 Len=0 MSS=1460 SACK_PERM=1 TSval=2198222161 TSecr=2958671831 WS=128
    9 17.942700511  2.18.74.134 → 192.168.1.16 TCP 60 [TCP Retransmission] 80 → 55060 [SYN, ACK] Seq=0 Ack=1 Win=65160 Len=0 MSS=1460 SACK_PERM=1 TSval=2198226193 TSecr=2958671831 WS=128
   10 24.000014862 fe80::5f82:2b04:1f71:f78b → ff02::2      ICMPv6 48 Router Solicitation
   11 26.134602261  2.18.74.134 → 192.168.1.16 TCP 60 [TCP Retransmission] 80 → 55060 [SYN, ACK] Seq=0 Ack=1 Win=65160 Len=0 MSS=1460 SACK_PERM=1 TSval=2198234385 TSecr=2958671831 WS=128
   12 42.518744411  2.18.74.134 → 192.168.1.16 TCP 60 [TCP Retransmission] 80 → 55060 [SYN, ACK] Seq=0 Ack=1 Win=65160 Len=0 MSS=1460 SACK_PERM=1 TSval=2198250769 TSecr=2958671831 WS=128

   tshark mobile:

   3 2.801271985 192.168.1.16 → 2.18.74.134  TCP 60 55060 → 80 [SYN] Seq=0 Win=64240 Len=0 MSS=1460 SACK_PERM=1 TSval=2958671831 TSecr=0 WS=128
    4 2.833437916  2.18.74.134 → 192.168.1.16 TCP 60 80 → 55060 [SYN, ACK] Seq=0 Ack=1 Win=65160 Len=0 MSS=1460 SACK_PERM=1 TSval=2198219085 TSecr=2958671831 WS=128
    5 2.833499323 192.168.1.16 → 2.18.74.134  TCP 52 55060 → 80 [ACK] Seq=1 Ack=1 Win=64256 Len=0 TSval=2958671863 TSecr=2198219085
    6 2.833610471 192.168.1.16 → 2.18.74.134  HTTP 125 GET / HTTP/1.1 
    7 3.075104304 192.168.1.16 → 2.18.74.134  TCP 125 [TCP Retransmission] 55060 → 80 [PSH, ACK] Seq=1 Ack=1 Win=64256 Len=73 TSval=2958672105 TSecr=2198219085
    8 3.325104165 192.168.1.16 → 2.18.74.134  TCP 125 [TCP Retransmission] 55060 → 80 [PSH, ACK] Seq=1 Ack=1 Win=64256 Len=73 TSval=2958672355 TSecr=2198219085
    9 3.815126586 192.168.1.16 → 2.18.74.134  TCP 125 [TCP Retransmission] 55060 → 80 [PSH, ACK] Seq=1 Ack=1 Win=64256 Len=73 TSval=2958672845 TSecr=2198219085
   10 3.869370000  2.18.74.134 → 192.168.1.16 TCP 60 [TCP Retransmission] 80 → 55060 [SYN, ACK] Seq=0 Ack=1 Win=65160 Len=0 MSS=1460 SACK_PERM=1 TSval=2198220114 TSecr=2958671831 WS=128
   11 3.869413722 192.168.1.16 → 2.18.74.134  TCP 52 [TCP Dup ACK 5#1] 55060 → 80 [ACK] Seq=74 Ack=1 Win=64256 Len=0 TSval=2958672899 TSecr=2198219085
   12 4.835210740 192.168.1.16 → 2.18.74.134  TCP 125 [TCP Retransmission] 55060 → 80 [PSH, ACK] Seq=1 Ack=1 Win=64256 Len=73 TSval=2958673865 TSecr=2198219085
   13 5.914486903  2.18.74.134 → 192.168.1.16 TCP 60 [TCP Retransmission] 80 → 55060 [SYN, ACK] Seq=0 Ack=1 Win=65160 Len=0 MSS=1460 SACK_PERM=1 TSval=2198222161 TSecr=2958671831 WS=128
   14 5.914535569 192.168.1.16 → 2.18.74.134  TCP 52 [TCP Dup ACK 5#2] 55060 → 80 [ACK] Seq=74 Ack=1 Win=64256 Len=0 TSval=2958674944 TSecr=2198219085
   15 6.835116181 192.168.1.16 → 2.18.74.134  TCP 125 [TCP Retransmission] 55060 → 80 [PSH, ACK] Seq=1 Ack=1 Win=64256 Len=73 TSval=2958675865 TSecr=2198219085
   16 7.155111570 fe80::4a6b:1559:f7e9:1ab8 → ff02::2      ICMPv6 48 Router Solicitation
tshark: The network adapter "tun0" is no longer attached; the capture has stopped.

app prints base:

Received 120 bytes on pipe 0: b'4500003c383340004006f438c0a8011002124a86d714005017f91b9200000000a002faf0c39d0000020405b40402080ab059bfd70000000001030307'
Transmission successful! Packet number: 4. Time to Transmit: 2.285792 ms. Sent: b'000100054500003c00004000f806746b'. Size: 32
Transmission successful! Packet number: 4. Time to Transmit: 2.218292 ms. Sent: b'0002000502124a86c0a801100050d714'. Size: 32
Transmission successful! Packet number: 4. Time to Transmit: 2.28655 ms. Sent: b'000300057916b55c17f91b93a012fe88'. Size: 32
Transmission successful! Packet number: 4. Time to Transmit: 2.27607 ms. Sent: b'00040005e52d0000020405b40402080a'. Size: 32
Transmission successful! Packet number: 4. Time to Transmit: 2.26894 ms. Sent: b'000500058306294db059bfd701030307'. Size: 32
Process Process-2:
Traceback (most recent call last):
  File "/usr/lib/python3.9/multiprocessing/process.py", line 315, in _bootstrap
    self.run()
  File "/usr/lib/python3.9/multiprocessing/process.py", line 108, in run
    self._target(*self._args, **self._kwargs)
  File "/home/fideloper/imes/app/app_base.py", line 55, in rx
    no_of_fragments = int(buffer[4:8])
ValueError: invalid literal for int() with base 10: b'000b'



utvecklad print:

Transmission successful! Packet number: 4. Time to Transmit: 2.265938 ms. Sent: b'000100054500003c00004000f806746b'. Size: 32
Transmission successful! Packet number: 4. Time to Transmit: 2.254976 ms. Sent: b'0002000502124a86c0a801100050d716'. Size: 32
Transmission successful! Packet number: 4. Time to Transmit: 2.250402 ms. Sent: b'0003000579d2ac8b66afd786a012fe88'. Size: 32
Transmission successful! Packet number: 4. Time to Transmit: 2.26005 ms. Sent: b'0004000534440000020405b40402080a'. Size: 32
Transmission successful! Packet number: 4. Time to Transmit: 2.306142 ms. Sent: b'000500058310806db06416f501030307'. Size: 32
raw received data: bytearray(b'0001000545000034a1eb400040068a88')
raw received data: bytearray(b'00020005c0a8011002124a86d7160050')
raw received data: bytearray(b'0003000566afd78679d2ac8c801001f6')
raw received data: bytearray(b'000400055f8100000101080ab0641717')
raw received data: bytearray(b'0000000000000000000500058310806d')
raw received data: bytearray(b'0001000b4500007da1ec400040068a3e')  # här!
Process Process-2:
Traceback (most recent call last):
  File "/usr/lib/python3.9/multiprocessing/process.py", line 315, in _bootstrap
    self.run()
  File "/usr/lib/python3.9/multiprocessing/process.py", line 108, in run
    self._target(*self._args, **self._kwargs)
  File "/home/fideloper/imes/app/app_base.py", line 56, in rx
    no_of_fragments = int(buffer[4:8])
ValueError: invalid literal for int() with base 10: b'000b'