#tshark base (after inverting w zfill)
Running as user "root" and group "root". This could be dangerous.
Capturing on 'tun0'
    1 0.000000000 fe80::bf56:f645:5d9a:13d2 → ff02::2      ICMPv6 48 Router Solicitation
    2 4.647614359 fe80::8664:c72c:1951:6287 → ff02::2      ICMPv6 48 Router Solicitation
    3 7.247740147 fe80::8664:c72c:1951:6287 → ff02::2      ICMPv6 48 Router Solicitation
    4 8.949997442 fe80::bf56:f645:5d9a:13d2 → ff02::2      ICMPv6 48 Router Solicitation
    5 10.406640909 192.168.1.16 → 2.18.74.134  TCP 60 55256 → 80 [SYN] Seq=0 Win=64240 Len=0 MSS=1460 SACK_PERM=1 TSval=2962523261 TSecr=0 WS=128
    6 10.416162467  2.18.74.134 → 192.168.1.16 TCP 60 80 → 55256 [SYN, ACK] Seq=0 Ack=1 Win=65160 Len=0 MSS=1460 SACK_PERM=1 TSval=4248560253 TSecr=2962523261 WS=128
    7 10.440155074 192.168.1.16 → 2.18.74.134  TCP 60 55256 → 80 [ACK] Seq=1 Ack=1 Win=64256 Len=0 TSval=2962523295 TSecr=4248560253
    8 10.458348858 192.168.1.16 → 2.18.74.134  HTTP 132 GET / HTTP/1.1 
    9 10.467635769  2.18.74.134 → 192.168.1.16 TCP 52 80 → 55256 [ACK] Seq=1 Ack=74 Win=65152 Len=0 TSval=4248560305 TSecr=2962523295
   10 10.469185470  2.18.74.134 → 192.168.1.16 HTTP 463 HTTP/1.1 301 Moved Permanently 
   11 10.699401173 192.168.1.16 → 2.18.74.134  HTTP 132 [TCP Spurious Retransmission] GET / HTTP/1.1 
   12 10.708733750  2.18.74.134 → 192.168.1.16 TCP 64 [TCP Dup ACK 9#1] 80 → 55256 [ACK] Seq=412 Ack=74 Win=65152 Len=0 TSval=4248560546 TSecr=2962523545 SLE=1 SRE=74
   13 10.729740381  2.18.74.134 → 192.168.1.16 TCP 463 [TCP Retransmission] 80 → 55256 [PSH, ACK] Seq=1 Ack=74 Win=65152 Len=411 TSval=4248560567 TSecr=2962523545
   14 10.949780565 192.168.1.16 → 2.18.74.134  HTTP 132 [TCP Spurious Retransmission] GET / HTTP/1.1 
   15 10.959050290  2.18.74.134 → 192.168.1.16 TCP 64 [TCP Dup ACK 9#2] 80 → 55256 [ACK] Seq=412 Ack=74 Win=65152 Len=0 TSval=4248560796 TSecr=2962523795 SLE=1 SRE=74
   16 10.984772228  2.18.74.134 → 192.168.1.16 TCP 463 [TCP Retransmission] 80 → 55256 [PSH, ACK] Seq=1 Ack=74 Win=65152 Len=411 TSval=4248560822 TSecr=2962523795
   17 11.447658316 192.168.1.16 → 2.18.74.134  HTTP 132 [TCP Spurious Retransmission] GET / HTTP/1.1 
   18 11.456972800  2.18.74.134 → 192.168.1.16 TCP 64 [TCP Dup ACK 9#3] 80 → 55256 [ACK] Seq=412 Ack=74 Win=65152 Len=0 TSval=4248561294 TSecr=2962524285 SLE=1 SRE=74
   19 11.496860511  2.18.74.134 → 192.168.1.16 TCP 463 [TCP Retransmission] 80 → 55256 [PSH, ACK] Seq=1 Ack=74 Win=65152 Len=411 TSval=4248561334 TSecr=2962524285
   20 12.464942299 192.168.1.16 → 2.18.74.134  HTTP 132 [TCP Spurious Retransmission] GET / HTTP/1.1 
   21 12.474287765  2.18.74.134 → 192.168.1.16 TCP 64 [TCP Dup ACK 9#4] 80 → 55256 [ACK] Seq=412 Ack=74 Win=65152 Len=0 TSval=4248562311 TSecr=2962525305 SLE=1 SRE=74
   22 12.521733870  2.18.74.134 → 192.168.1.16 TCP 463 [TCP Retransmission] 80 → 55256 [PSH, ACK] Seq=1 Ack=74 Win=65152 Len=411 TSval=4248562359 TSecr=2962525305
tshark: The network adapter "tun0" is no longer attached; the capture has stopped.